<?xml version="1.0" encoding="utf-8"?>
<xs:schema xmlns:xs="http://www.w3.org/2001/XMLSchema">
    <xs:element name="orders">
        <xs:complexType>
            <xs:sequence>
                <xs:element name="order" maxOccurs="unbounded">
                    <xs:complexType>
                        <xs:sequence>
                            <xs:element name="customerid" type="xs:integer"></xs:element>
                            <xs:element name="status" type="xs:string"></xs:element>
                            <xs:element name="item" maxOccurs="unbounded">
                                <xs:complexType>
                                    <xs:sequence>
                                        <xs:element name="name" type="xs:string"></xs:element>
                                        <xs:element name="price" type="xs:double"></xs:element>
                                        <xs:element name="qty" type="xs:integer"></xs:element>
                                    </xs:sequence>
                                    <xs:attribute name="instock" type="instock"></xs:attribute>
                                    <xs:attribute name="itemid" type="xs:string"></xs:attribute>
                                </xs:complexType>
                            </xs:element>
                        </xs:sequence>
                    </xs:complexType>
                </xs:element>
            </xs:sequence>
        </xs:complexType>
    </xs:element>
    <xs:simpleType name="instock">
        <xs:restriction base="xs:string">
            <xs:enumeration value="Y" />
            <xs:enumeration value="N" />
        </xs:restriction>
    </xs:simpleType>
</xs:schema>